{
  "checks": [
    {
      "check_id": "match_c3",
      "detail": "c3 matches core_invariants (diff=-1.9766621143557231045653576346131285639456177591940951656395805672077770545568299e-82)",
      "passed": true,
      "severity": "PASS"
    },
    {
      "check_id": "match_varphi0_tree",
      "detail": "varphi0_tree matches core_invariants (diff=-2.6355494858076308060871435128175047519274903455921268875194407562770360727424399e-82)",
      "passed": true,
      "severity": "PASS"
    },
    {
      "check_id": "match_delta_top",
      "detail": "delta_top matches core_invariants (diff=-4.5041128907845253033715831517877278475323321335802949737881067612156378196281932e-84)",
      "passed": true,
      "severity": "PASS"
    },
    {
      "check_id": "match_varphi0",
      "detail": "varphi0 matches core_invariants (diff=-1.9766621143557231045653576346131285639456177591940951656395805672077770545568299e-82)",
      "passed": true,
      "severity": "PASS"
    },
    {
      "check_id": "match_beta_rad",
      "detail": "beta_rad matches core_invariants (diff=1.6472184286297692538044646955109404699546814659950793046996504726731475454640249e-83)",
      "passed": true,
      "severity": "PASS"
    },
    {
      "check_id": "varphi0_identity",
      "detail": "varphi0 = varphi0_tree + delta_top (0.053171952176845527309292471969749667875127759799791139640450979685319457237554636)",
      "passed": true,
      "severity": "PASS"
    },
    {
      "check_id": "beta_rad_identity",
      "detail": "beta_rad = varphi0/(4*pi) (0.0042312895113954151087468182088050163950728077266837257698944229030526732721556263)",
      "passed": true,
      "severity": "PASS"
    }
  ],
  "module_id": "seed_invariants_audit",
  "plot": {
    "seed_invariants_png": "/Users/stefanhamann/Projekte/TFPT Github/tfpt-suite/theoryv3/out/seed_invariants_audit/seed_invariants.png"
  },
  "results": {
    "comparison": {
      "beta_rad": {
        "diff": "1.6472184286297692538044646955109404699546814659950793046996504726731475454640249e-83",
        "ref": "0.0042312895113954151087468182088050163950728077266837257698944229030526732721556263"
      },
      "c3": {
        "diff": "-1.9766621143557231045653576346131285639456177591940951656395805672077770545568299e-82",
        "ref": "0.039788735772973833942220940843128590508614911435114112186916836014724199408556634"
      },
      "delta_top": {
        "diff": "-4.5041128907845253033715831517877278475323321335802949737881067612156378196281932e-84",
        "ref": "0.00012030447954708205299788417891154719697454455297232339122853166568719135947912407"
      },
      "varphi0": {
        "diff": "-1.9766621143557231045653576346131285639456177591940951656395805672077770545568299e-82",
        "ref": "0.053171952176845527309292471969749667875127759799791139640450979685319457237554636"
      },
      "varphi0_tree": {
        "diff": "-2.6355494858076308060871435128175047519274903455921268875194407562770360727424399e-82",
        "ref": "0.053051647697298445256294587790838120678153215246818816249222448019632265878075512"
      }
    },
    "plot": {
      "seed_invariants_png": "/Users/stefanhamann/Projekte/TFPT Github/tfpt-suite/theoryv3/out/seed_invariants_audit/seed_invariants.png"
    },
    "values": {
      "beta_rad": "0.0042312895113954151087468182088050163950728077266837257698944229030526732721556263",
      "c3": "0.039788735772973833942220940843128590508614911435114112186916836014724199408556634",
      "delta_top": "0.00012030447954708205299788417891154719697454455297232339122853166568719135947912407",
      "pi": "3.141592653589793238462643383279502884197169399375105820974944592307816406286209",
      "varphi0": "0.053171952176845527309292471969749667875127759799791139640450979685319457237554636",
      "varphi0_tree": "0.053051647697298445256294587790838120678153215246818816249222448019632265878075512"
    }
  },
  "schema_version": 1,
  "spec": {
    "assumptions": [],
    "determinism": "Deterministic (pure algebra).",
    "formulas": [
      "c3 = 1/(8*pi)",
      "varphi0_tree = 1/(6*pi)",
      "delta_top = 3/(256*pi^4)",
      "varphi0 = varphi0_tree + delta_top",
      "beta_rad = varphi0/(4*pi)"
    ],
    "gaps": [],
    "inputs": [
      "pi"
    ],
    "maturity": null,
    "module_id": "seed_invariants_audit",
    "name": "Seed invariants audit (pi -> c3, varphi0, beta_rad)",
    "objective": [
      "Make the pi-seed dependency explicit and auditable.",
      "Provide a compact reference table for downstream audits."
    ],
    "outputs": [
      "c3",
      "varphi0_tree",
      "delta_top",
      "varphi0",
      "beta_rad"
    ],
    "question": "Does pi alone fix the core invariants used across TFPT?",
    "references": [],
    "validation": [
      "internal identities are satisfied",
      "optional match to core_invariants output if present"
    ],
    "what_was_done": []
  },
  "warnings": []
}
