{
  "checks": [
    {
      "check_id": "vetted_bounds_loaded",
      "detail": "bounds=4; tightest=A_X:2.100e-31 GeV",
      "passed": true,
      "severity": null
    },
    {
      "check_id": "proposals_generated",
      "detail": "proposals=2 (compatible with torsion_regimes.json schema)",
      "passed": true,
      "severity": null
    }
  ],
  "module_id": "ux_torsion_regime_designer",
  "plot": {
    "torsion_regime_designer_png": "/Users/stefanhamann/Projekte/TFPT Github/tfpt-suite/out/unconventional/ux_torsion_regime_designer/torsion_regime_designer.png"
  },
  "results": {
    "anchors": [
      {
        "S_mu_pred_cspin_1_GeV": 3.2396753580225e-56,
        "c_spin_max_to_saturate_tightest_bound": 6.482130978956612e+24,
        "coupling_kind": "Mpl_reduced",
        "delta_nu_Hz_cspin_1": 1.1750250244906354e-32,
        "label": "laboratory_electron_gas",
        "n_unit": "cm^-3",
        "n_value": 1e+23,
        "polarization": 0.5,
        "spin_per_particle": 0.5
      },
      {
        "S_mu_pred_cspin_1_GeV": 3.2832238430084956e-31,
        "c_spin_max_to_saturate_tightest_bound": 0.6396152380751842,
        "coupling_kind": "TFPT_M",
        "delta_nu_Hz_cspin_1": 1.1908199897208659e-07,
        "label": "nuclear_matter_core",
        "n_unit": "fm^-3",
        "n_value": 0.16,
        "polarization": 0.5,
        "spin_per_particle": 0.5
      },
      {
        "S_mu_pred_cspin_1_GeV": 4.104029803760619e-30,
        "c_spin_max_to_saturate_tightest_bound": 0.051169219046014736,
        "coupling_kind": "TFPT_M",
        "delta_nu_Hz_cspin_1": 1.4885249871510824e-06,
        "label": "extreme_dense_spin_fluid",
        "n_unit": "fm^-3",
        "n_value": 1.0,
        "polarization": 1.0,
        "spin_per_particle": 0.5
      }
    ],
    "bounds": {
      "all": [
        {
          "abs_max_GeV": 2.1e-31,
          "component": "X",
          "label": "A_X",
          "source": "Kosteleck\u00fd\u2013Russell\u2013Tasson 2008 (Phys. Rev. Lett. 100, 111102), arXiv:0712.4393 Eq. (6)"
        },
        {
          "abs_max_GeV": 2.5e-31,
          "component": "Y",
          "label": "A_Y",
          "source": "Kosteleck\u00fd\u2013Russell\u2013Tasson 2008 (Phys. Rev. Lett. 100, 111102), arXiv:0712.4393 Eq. (6)"
        },
        {
          "abs_max_GeV": 1e-29,
          "component": "Z",
          "label": "A_Z",
          "source": "Kosteleck\u00fd\u2013Russell\u2013Tasson 2008 (Phys. Rev. Lett. 100, 111102), arXiv:0712.4393 Eq. (6)"
        },
        {
          "abs_max_GeV": 2.9e-27,
          "component": "T",
          "label": "A_T",
          "source": "Kosteleck\u00fd\u2013Russell\u2013Tasson 2008 (Phys. Rev. Lett. 100, 111102), arXiv:0712.4393 Eq. (6)"
        }
      ],
      "file": "/Users/stefanhamann/Projekte/TFPT Github/tfpt-suite/tfpt_suite/data/torsion_bounds_vetted.json",
      "tightest": {
        "abs_max_GeV": 2.1e-31,
        "component": "X",
        "label": "A_X",
        "source": "Kosteleck\u00fd\u2013Russell\u2013Tasson 2008 (Phys. Rev. Lett. 100, 111102), arXiv:0712.4393 Eq. (6)"
      }
    },
    "plot": {
      "torsion_regime_designer_png": "/Users/stefanhamann/Projekte/TFPT Github/tfpt-suite/out/unconventional/ux_torsion_regime_designer/torsion_regime_designer.png"
    },
    "proposals": [
      {
        "c_spin": 1.0,
        "compare_to_bounds": true,
        "coupling_scale": {
          "kind": "Mpl_reduced"
        },
        "id": "spin_medium_candidate_1",
        "label": "Spin-polarized medium candidate 1 (Mpl_reduced)",
        "model": "spin_polarized_medium",
        "note": "Generated by ux_torsion_regime_designer. Toy model: |S_mu| ~ c_spin*(pol*spin*n)/M_eff^2. c_spin is not derived here; it is a target for the microscopic operator derivation. Chosen c_spin=1 (\u22480.5*c_spin_max) to stay safely below the tightest bound.",
        "number_density": {
          "unit": "cm^-3",
          "value": 9.942165874700114e+25
        },
        "polarization": 0.874415766700875,
        "spin_per_particle": 0.5
      },
      {
        "c_spin": 0.5069493937932988,
        "compare_to_bounds": true,
        "coupling_scale": {
          "kind": "TFPT_M"
        },
        "id": "spin_medium_candidate_2",
        "label": "Spin-polarized medium candidate 2 (TFPT_M)",
        "model": "spin_polarized_medium",
        "note": "Generated by ux_torsion_regime_designer. Toy model: |S_mu| ~ c_spin*(pol*spin*n)/M_eff^2. c_spin is not derived here; it is a target for the microscopic operator derivation. Chosen c_spin=0.507 (\u22480.5*c_spin_max) to stay safely below the tightest bound.",
        "number_density": {
          "unit": "fm^-3",
          "value": 0.2812392339668995
        },
        "polarization": 0.17944785798956178,
        "spin_per_particle": 0.5
      }
    ],
    "sampling": {
      "best_mpl_reduced": {
        "S_mu_pred_cspin_1_GeV": 5.63287965357476e-53,
        "c_spin_max_to_saturate_tightest_bound": 3.728110893807734e+21,
        "coupling_kind": "Mpl_reduced",
        "delta_nu_Hz_cspin_1": 2.0430363605736686e-29,
        "n_unit": "cm^-3",
        "n_value": 9.942165874700114e+25,
        "polarization": 0.874415766700875,
        "spin_per_particle": 0.5
      },
      "best_tfpt_M": {
        "S_mu_pred_cspin_1_GeV": 2.0712126552578974e-31,
        "c_spin_max_to_saturate_tightest_bound": 1.0138987875865977,
        "coupling_kind": "TFPT_M",
        "delta_nu_Hz_cspin_1": 7.512254877461776e-08,
        "n_unit": "fm^-3",
        "n_value": 0.2812392339668995,
        "polarization": 0.17944785798956178,
        "spin_per_particle": 0.5
      },
      "candidates_kept": 1200,
      "samples": 1200
    }
  },
  "schema_version": 1,
  "spec": {
    "assumptions": [],
    "determinism": "Deterministic given config seed (random sampling for scenario exploration).",
    "formulas": [
      "toy spin-medium model: |S_mu| ~ c_spin * (pol * spin_per_particle * n) / M_eff^2",
      "compute c_spin_max := bound / S_pred(c_spin=1) for saturation targets"
    ],
    "gaps": [],
    "inputs": [
      "vetted bounds: tfpt_suite/data/torsion_bounds_vetted.json (A_mu component-wise limits)",
      "TFPT scale M from constants.py (for coupling_kind='TFPT_M')"
    ],
    "maturity": null,
    "module_id": "ux_torsion_regime_designer",
    "name": "Unconventional: torsion regime designer (spin-polarized medium + bound saturation targets)",
    "objective": [],
    "outputs": [
      "tightest bound summary",
      "scenario table (S_pred for c_spin=1, and c_spin needed to saturate bounds)",
      "JSON regime proposals compatible with tfpt_suite/data/torsion_regimes.json"
    ],
    "question": null,
    "references": [],
    "validation": [
      "produce at least one explicit regime proposal (even if conservative)",
      "make all assumptions explicit (toy model; c_spin is a derivation target)"
    ],
    "what_was_done": []
  },
  "warnings": []
}
