{
  "checks": [
    {
      "check_id": "torsion_observable_table_present",
      "detail": "rows=2",
      "passed": true,
      "severity": "PASS"
    },
    {
      "check_id": "amplitude_measurable",
      "detail": "proxy_ok=True (lab \u0394\u03bd\u22482.084e-23 Hz, astro \u0394\u03bd\u22482.382e-07 Hz; thresholds=1.0e-09 Hz)",
      "passed": true,
      "severity": "PASS"
    }
  ],
  "module_id": "torsion_observable_designer",
  "plot": null,
  "results": {
    "M_eff_GeV": 30595633972661.27,
    "mode": "physics",
    "proxy_thresholds_Hz": {
      "astro": 1e-09,
      "lab": 1e-09
    },
    "rows": [
      {
        "M_eff_GeV": 30595633972661.27,
        "S_abs_GeV": 5.745641725264868e-47,
        "b_abs_GeV": 4.309231293948651e-47,
        "delta_nu_Hz": 2.0839349820115158e-23,
        "label": "Lab spin fluid (He-3 benchmark)",
        "model": "spin_polarized_medium",
        "note": "Order-of-magnitude lab density; intended as a falsifiability baseline.",
        "scenario_id": "lab_spin_fluid_He3",
        "spin_density_GeV3": 5.378453954907869e-20
      },
      {
        "M_eff_GeV": 30595633972661.27,
        "S_abs_GeV": 6.566447686016991e-31,
        "b_abs_GeV": 4.924835764512743e-31,
        "delta_nu_Hz": 2.3816399794417318e-07,
        "label": "Nuclear spin density (magnetar proxy)",
        "model": "spin_polarized_medium",
        "note": "Order-of-magnitude nuclear density; not an Earth lab bound regime. Intended for astrophysical amplification discussion.",
        "scenario_id": "nuclear_spin_density_magnetar_proxy",
        "spin_density_GeV3": 0.0006146804519894706
      }
    ]
  },
  "schema_version": 1,
  "spec": {
    "assumptions": [],
    "determinism": "Deterministic given benchmark constants.",
    "formulas": [
      "|S| \\sim \\rho_{\\rm spin}/M_{\\rm eff}^2,\\;\\; |b|=k|S|,\\;\\; \\Delta\\nu\\approx 2|b|\\cdot(\\mathrm{GeV}\\to\\mathrm{Hz})"
    ],
    "gaps": [
      "Benchmarks use a toy source model and TFPT-scale coupling assumption; publication-grade needs derived source dynamics + real observables/noise model."
    ],
    "inputs": [
      "TFPT scale M from constants (R^2 scale) used as coupling-scale proxy",
      "torsion bounds mapping constant k=3/4 (minimal coupling)"
    ],
    "maturity": null,
    "module_id": "torsion_observable_designer",
    "name": "Torsion observable designer (magnetar + lab signal proxies)",
    "objective": [
      "Turn the torsion-falsifiability task into a concrete, assumption-explicit signal-size table.",
      "Provide a path to a real experimental design (replace benchmarks with a derived source model + instrument noise model)."
    ],
    "outputs": [
      "two benchmark scenarios (lab spin-fluid, nuclear/magnetar-like spin density) with predicted \u0394\u03bd scales",
      "amplitude_measurable gate (design-phase; physics mode remains strict)"
    ],
    "question": "What torsion observable magnitude could be targeted in lab vs astrophysical regimes under TFPT-scale coupling assumptions?",
    "references": [],
    "validation": [
      "amplitude_measurable check is emitted (PASS/WARN/FAIL depending on mode and proxy thresholds)."
    ],
    "what_was_done": []
  },
  "warnings": []
}
